[
  {
    "order": 1,
    "name": "AWS Certified Solutions Architect",
    "issuer": "Amazon Web Services",
    "issued_date": "12-01-2015",
    "expired_date": "12-01-2017",
    "tags": [
      "aws",
      "cloud"
    ]
  },
  {
    "order": 0,
    "name": "Data Security and Privacy",
    "issuer": "Everfi",
    "issued_date": "11-01-2017",
    "tags": [
      "security",
      "privacy"
    ]
  }
]
